### ISSUE TITLE
Fix ConnectTimeout for cg-archive

### ISSUE THREAD

**Issue by ahdamin** [Clinical-Genomics/cg#5182]
## Issue
@Vince-janv reported that service `cg-archive-update-job-statuses.service` failed yesterday.
By checking the the OnFailure email, the request hung:
```
Jul 06 21:00:22 ... INFO Sending GET request for job 850135
Jul 06 21:02:29 ... Traceback (most recent call last):
```
The logs show no timeout or retry handling:
```
urllib3.exceptions.ConnectTimeoutError: (... 'Connection to cg-df-cat.scilifelab.se timed out. (connect timeout=None)')
```
As a result, one lost connection kills the whole unit:
```
File ".../cg/meta/archive/archive.py", line 167, in update_ongoing_task
    is_job_done: bool = archive_handler.is_job_done(task_id)
...
requests.exceptions.ConnectTimeout: ... /restapi/activity/jobs/850135
Jul 06 21:02:30 systemd[5597]: cg-archive-update-job-statuses.service: main process exited, code=exited, status=1/FAILURE
```

**Comment by ahdamin** [comment]
@Vince-janv raised an important concern about retrying POSTs.
When I took a look at the DDN schema now: of course, the `archive/retrieve/delete` endpoints are side-effecting POSTs, so we should not retry POSTs. 
However, it should be OK because `urllib3`'s default `allowed_methods` excludes POST, so POSTs are not retried on `429/5xx` responses. The **only** POST retry case here is a `ConnectTimeoutError`, which `urllib3` treats as a connection failure before the request reached the server.

**Comment by ahdamin** [comment]
There was another incident today around 15.30:
```
Jul 09 15:32:39 [hasta.scilifelab.se](http://hasta.scilifelab.se/) bash[231395]: File "/home/proj/production/bin/miniconda3/envs/P_cg.blue/lib/python3.11/site-packages/requests/adapters.py", line 507, in send
Jul 09 15:32:39 [hasta.scilifelab.se](http://hasta.scilifelab.se/) bash[231395]: raise ConnectTimeout(e, request=request)
Jul 09 15:32:39 [hasta.scilifelab.se](http://hasta.scilifelab.se/) bash[231395]: requests.exceptions.ConnectTimeout: HTTPSConnectionPool(host='[cg-df-cat.scilifelab.se](http://cg-df-cat.scilifelab.se/)', port=443): Max retries exceeded with url: /restapi/activity/jobs/853796 (Caused by ConnectTimeoutError(<urllib3.connection.HTTPSConnection object at 0x7f151bb5f610>, 'Connection to [cg-df-cat.scilifelab.se](http://cg-df-cat.scilifelab.se/) timed out. (connect timeout=None)'))
Jul 09 15:32:39 [hasta.scilifelab.se](http://hasta.scilifelab.se/) systemd[5597]: cg-archive-update-job-statuses.service: main process exited, code=exited, status=1/FAILURE
Jul 09 15:32:39 [hasta.scilifelab.se](http://hasta.scilifelab.se/) systemd[5597]: Failed to start Update status of ongoing DDN/Miria jobs.
Jul 09 15:32:39 [hasta.scilifelab.se](http://hasta.scilifelab.se/) systemd[5597]: Unit cg-archive-update-job-statuses.service entered failed state.
Jul 09 15:32:39 [hasta.scilifelab.se](http://hasta.scilifelab.se/) systemd[5597]: Triggering OnFailure= dependencies of cg-archive-update-job-statuses.service.
Jul 09 15:32:39 [hasta.scilifelab.se](http://hasta.scilifelab.se/) systemd[5597]: cg-archive-update-job-statuses.service failed.
```

I checked the tcpdump logs:
```
tcpdump -nn -r /var/tmp/cg0014_syn_20260708_1645.pcap | awk '$1 >= "15:30:20" && $1 <= "15:33:00"'
```
The flags request, acceptance, and acknowledgment should be as follow:
```
Flags [S] = SYN — hasta: "I want to open a connection"
Flags [S.] = SYN-ACK — the server: "accepted, confirm back" (the dot after S means the ACK flag is set together with SYN)
Flags [.] = ACK — hasta confirms, and the connection is open
```

However, in the logs:
```
15:30:31.031731 IP 130.237.81.137.49476 > 130.237.81.42.443: Flags [S]    ← step 1 arrives
15:30:31.031769 IP 130.237.81.42.443 > 130.237.81.137.49476: Flags [S.]   ← step 2 answered
15:30:31.285532 IP 130.237.81.137.49478 > 130.237.81.42.443: Flags [S]    ← step 1 arrives
15:30:31.285575 IP 130.237.81.42.443 > 130.237.81.137.49478: Flags [S.]   ← step 2 answered
```
While we expected also:
```
(~15:30:31.5   expected: Flags [S] from 130.237.81.137, a new port   ← NEVER ARRIVES)
(~15:30:32     expected: the same [S] re-sent                        ← NEVER ARRIVES)
(~15:30:34, :38, :46, 15:31:02, 15:31:34 — five more re-sends        ← NONE ARRIVE)
```
But after that, there were other unrelated healthy connections:
```
15:30:50.920181 IP 130.237.81.137.49596 > 130.237.81.42.443: Flags [S]    ← step 1 arrives
15:30:50.920227 IP 130.237.81.42.443 > 130.237.81.137.49596: Flags [S.]   ← step 2 answered
15:31:18.871167 ... Flags [S]  /  15:31:18.871214 ... Flags [S.]          ← healthy
15:31:53.532216 ... Flags [S]  /  15:31:53.532267 ... Flags [S.]          ← healthy
15:32:33.263917 ... Flags [S]  /  15:32:33.263968 ... Flags [S.]          ← healthy
```
So, at 15:32:38 hasta gave up waiting and the service crashed.

The conclusion is by elimination:
- hasta created the messages
- hasta's network card sent them out
- They never arrived at the archive server
- The server wasn't refusing or too busy

So, it is expected to be a network issue: a cable, a switch port, or a link. 

In this [commit](https://github.com/Clinical-Genomics/cg/pull/5183/commits/a5b233da6bb323be6a8b2b85216b3498132d4423) I excluded POST calls from the retry, due to the risk highlighted by @Vince-janv

**Comment by ahdamin** [comment]
Here is the IT Ticket `#ID:KTH-INC-5299751#`
